{
  "synonyms_version": "1.0.0",
  "normalisation": {
    "casefold": true,
    "fold_separators": [
      "-",
      "_",
      " "
    ],
    "split_camel_case": true,
    "strip_trailing_colon": true
  },
  "forms": {
    "insdc-assembly-accession": {
      "pattern": "(?:NCBI_Assembly:)?GC[AF]_\\d{9}\\.\\d+",
      "description": "Versioned INSDC/RefSeq assembly accession, optional NCBI_Assembly: prefix",
      "identifier": true
    },
    "spdx-id": {
      "pattern": "[A-Za-z0-9.+-]+",
      "description": "SPDX licence identifier listed in the pinned SPDX licence list",
      "reference_table": "spdx-licenses",
      "identifier": true
    },
    "licence-url": {
      "pattern": "https?://(?:creativecommons\\.org/(?:licenses|publicdomain)/\\S+|opendatacommons\\.org/licenses/\\S+|spdx\\.org/licenses/\\S+)",
      "description": "Canonical URL of a standard licence (Creative Commons, Open Data Commons, SPDX)",
      "identifier": true
    },
    "taxonomy-iri": {
      "pattern": "https://identifiers\\.org/taxonomy:\\d+",
      "description": "Persistent NCBI Taxonomy IRI at identifiers.org",
      "identifier": true
    },
    "ncbi-taxonomy-url": {
      "pattern": "https?://www\\.ncbi\\.nlm\\.nih\\.gov/Taxonomy/Browser/wwwtax\\.cgi\\?\\S*id=\\d+\\S*",
      "description": "NCBI Taxonomy browser URL (a web page, not a persistent IRI)"
    },
    "orcid": {
      "pattern": "https://orcid\\.org/\\d{4}-\\d{4}-\\d{4}-\\d{3}[\\dX]",
      "description": "ORCID iD as a URI",
      "identifier": true
    },
    "doi": {
      "pattern": "(?:https://doi\\.org/|doi:)?10\\.\\d{4,9}/\\S+",
      "description": "Digital Object Identifier",
      "identifier": true
    },
    "registered-id": {
      "pattern": "\\S+",
      "description": "Identifier in a scheme of the pinned identifier-scheme table that is flagged persistent (prefix:local, DOI, or a GCA_/GCF_ accession)",
      "reference_table": "id-schemes",
      "identifier": true
    },
    "iso-date": {
      "pattern": "\\d{4}-\\d{2}(?:-\\d{2}(?:[T ]\\d{2}:\\d{2}(?::\\d{2}(?:\\.\\d+)?)?(?:Z|[+-]\\d{2}:?\\d{2})?)?)?",
      "description": "ISO 8601 date or date-time (reduced precision allowed)"
    },
    "vcf-date": {
      "pattern": "\\d{8}",
      "description": "VCF fileDate form YYYYMMDD"
    },
    "md5": {
      "pattern": "[0-9A-Fa-f]{32}",
      "description": "MD5 digest in hexadecimal",
      "identifier": true
    },
    "fhr-checksum": {
      "pattern": "[A-Za-z0-9+/]{43}=",
      "description": "FHR-family SHA-512/256 checksum in base64 (44 characters)",
      "identifier": true
    },
    "seqcol-digest": {
      "pattern": "[A-Za-z0-9_-]{32}",
      "description": "GA4GH sequence collection top-level digest (sha512t24u)",
      "identifier": true
    },
    "url": {
      "pattern": "(?:https?|ftp)://[^\\s/?#]+\\S*",
      "description": "URL with an http, https or ftp scheme"
    },
    "directory-url": {
      "pattern": "(?:https?|ftp)://[^\\s/?#]+/\\S*/",
      "description": "URL that names a directory (ends with /)"
    },
    "vocabulary-bound-format": {
      "pattern": "3(?:\\.\\d+)*|2\\.\\d+",
      "description": "Format version of a format whose specification mandates a vocabulary (GFF3: Sequence Ontology; GAF 2.x: Gene Ontology)"
    }
  },
  "concepts": {
    "format-version": {
      "description": "Declaration of the data format and its version",
      "keys": {
        "gff3-directive": [
          "gff-version"
        ],
        "vcf-meta": [
          "fileformat"
        ],
        "gaf": [
          "gaf-version"
        ]
      },
      "forms": [
        "vocabulary-bound-format"
      ],
      "scope": "file",
      "core_field": "schema",
      "emit": {
        "gff3-directive": "gff-version",
        "vcf-meta": "fileformat",
        "gaf": "gaf-version",
        "fair-bioheaders": "schema"
      }
    },
    "format-spec-version": {
      "description": "Version of the format specification followed (NCBI GFF3)",
      "keys": {
        "gff3-pragma": [
          "gff-spec-version"
        ]
      },
      "scope": "file",
      "core_field": null,
      "emit": {
        "gff3-pragma": "gff-spec-version",
        "fair-bioheaders": "schemaVersion"
      }
    },
    "header-schema": {
      "description": "Machine-readable schema of a FAIR-bioHeaders header",
      "keys": {
        "fair-bioheaders": [
          "schema"
        ]
      },
      "forms": [
        "url"
      ],
      "scope": "file",
      "core_field": "schema",
      "emit": {
        "fair-bioheaders": "schema"
      }
    },
    "header-schema-version": {
      "description": "Version of the FAIR-bioHeaders header schema",
      "keys": {
        "fair-bioheaders": [
          "schemaVersion"
        ]
      },
      "scope": "file",
      "core_field": "schemaVersion",
      "emit": {
        "fair-bioheaders": "schemaVersion"
      }
    },
    "context-iri": {
      "description": "Mapping of header keys to IRIs (JSON-LD context); no surveyed file has one",
      "keys": {
        "fair-bioheaders": [
          "@context"
        ]
      },
      "forms": [
        "url"
      ],
      "scope": "file",
      "core_field": null,
      "emit": {
        "fair-bioheaders": "@context"
      }
    },
    "sequence-region": {
      "description": "Declared sequence name and extent (circumstantial evidence only)",
      "keys": {
        "gff3-directive": [
          "sequence-region"
        ],
        "vcf-meta": [
          "contig"
        ]
      },
      "scope": "file",
      "core_field": null,
      "emit": {
        "gff3-directive": "sequence-region",
        "vcf-meta": "contig",
        "fair-bioheaders": "vitalStats"
      }
    },
    "assembly-accession": {
      "description": "Accession of the assembly a derived file refers to",
      "keys": {
        "gff3-pragma": [
          "genome-build-accession"
        ],
        "vcf-meta": [
          "reference"
        ],
        "vcf-contig": [
          "assembly"
        ],
        "fair-bioheaders": [
          "derivedFrom.accessionID.name"
        ]
      },
      "forms": [
        "insdc-assembly-accession"
      ],
      "scope": "file",
      "core_field": "derivedFrom.accessionID",
      "link_kind": "accession",
      "relationship": "annotates",
      "emit": {
        "gff3-pragma": "genome-build-accession",
        "vcf-meta": "reference",
        "fair-bioheaders": "derivedFrom"
      }
    },
    "reference-url": {
      "description": "URL of the reference sequence a derived file refers to",
      "keys": {
        "vcf-meta": [
          "reference"
        ],
        "vcf-contig": [
          "URL"
        ]
      },
      "forms": [
        "url"
      ],
      "scope": "file",
      "core_field": null,
      "link_kind": "url",
      "relationship": "annotates",
      "emit": {
        "vcf-meta": "reference",
        "fair-bioheaders": "derivedFrom"
      }
    },
    "assembly-name": {
      "description": "Name of the assembly or release a derived file refers to (not an identifier)",
      "keys": {
        "gff3-pragma": [
          "genome-build",
          "genome-version",
          "assembly"
        ],
        "gff3-directive": [
          "genome-build"
        ],
        "vcf-meta": [
          "reference"
        ],
        "vcf-contig": [
          "assembly"
        ],
        "fasta-defline": [
          "ensembl-coord-assembly",
          "release"
        ]
      },
      "scope": "file",
      "core_field": null,
      "link_kind": "name",
      "relationship": "annotates",
      "emit": {
        "gff3-pragma": "genome-build",
        "vcf-meta": "reference",
        "fair-bioheaders": "derivedFrom"
      }
    },
    "derived-checksum": {
      "description": "FHR-family checksum of the parent file",
      "keys": {
        "fair-bioheaders": [
          "derivedFrom.checksum"
        ]
      },
      "forms": [
        "fhr-checksum"
      ],
      "scope": "file",
      "core_field": "derivedFrom.checksum",
      "link_kind": "checksum",
      "emit": {
        "fair-bioheaders": "derivedFrom"
      }
    },
    "derived-seqcol": {
      "description": "Sequence collection digest of the parent file",
      "keys": {
        "fair-bioheaders": [
          "derivedFrom.seqcol_id"
        ]
      },
      "forms": [
        "seqcol-digest"
      ],
      "scope": "file",
      "core_field": "derivedFrom.seqcol_id",
      "link_kind": "seqcol",
      "emit": {
        "fair-bioheaders": "derivedFrom"
      }
    },
    "derived-relationship": {
      "description": "Stated relationship to the parent file",
      "keys": {
        "fair-bioheaders": [
          "derivedFrom.relationship"
        ]
      },
      "scope": "file",
      "core_field": "derivedFrom.relationship",
      "emit": {
        "fair-bioheaders": "derivedFrom"
      }
    },
    "sequence-digest": {
      "description": "Per-sequence MD5 digests of the reference sequences",
      "keys": {
        "vcf-contig": [
          "md5"
        ]
      },
      "forms": [
        "md5"
      ],
      "scope": "file",
      "core_field": null,
      "link_kind": "sequence-digests",
      "relationship": "annotates",
      "emit": {
        "vcf-meta": "contig",
        "fair-bioheaders": "derivedFrom"
      }
    },
    "record-digest": {
      "description": "MD5 digest of the record's own sequence (FlyBase defline); identifies the record, not a related file",
      "keys": {
        "fasta-defline": [
          "MD5"
        ]
      },
      "forms": [
        "md5"
      ],
      "scope": "first-record",
      "core_field": null,
      "emit": {
        "fair-bioheaders": "checksum"
      }
    },
    "record-xref": {
      "description": "Cross-reference of the first record (record-level only)",
      "keys": {
        "fasta-defline": [
          "dbxref",
          "uniprot",
          "insdc"
        ]
      },
      "scope": "first-record",
      "core_field": null,